time,agent_id,x,y,state,score,payoff,action_magnitude,action_direction,reasoning,personality
0,0,38.81596199895819,15.564026096753471,1,0.5294706551629315,0.5294706551629315,4.0,63.0,"Given my high extraversion (1.0), I'm inclined to interact extensively and build relationships. Considering the nearest cooperative neighbor at a distance of 2.24 is in the same direction as my current movement, I choose to cooperate with them, maintaining our relationship and potentially enhancing it by moving closer. This decision aligns with my agreeableness (0.8) trait, promoting harmonious interactions.","O:0.7, C:0.0, E:1.0, A:0.8, N:0.3"
0,1,36.36608289495492,16.516011703836273,1,0.2812747227072996,0.2812747227072996,3.0,123.0,"Given my high agreeableness (0.7) and openness (0.7), I tend to prioritize cooperation and building relationships. In this context, I see a cooperator at a relatively close distance (6.32) who is likely to reciprocate, so I choose to cooperate with them and move towards them (magnitude 3 in the direction of the neighbor).","O:0.7, C:0.3, E:0.5, A:0.7, N:0.1"
0,2,18.598076211353316,13.5,1,0.24275965521033224,0.24275965521033224,3.0,30.0,"Given my high extraversion (0.8), I'm inclined to interact and cooperate with cooperative neighbors, despite their distance. This decision is also influenced by my moderate agreeableness (0.5) and conscientiousness (0.7), which encourages me to consider the well-being of others while making rational choices.","O:0.1, C:0.7, E:0.8, A:0.5, N:0.3"
0,3,28.76393202250021,23.804226065180615,1,0.3796294176077468,0.3796294176077468,4.0,108.0,"Given my high openness to experience (1.0), I'm inclined to explore and interact with cooperative neighbors. In this context, I'll cooperate with the neighbor at a distance of 9.49 with direction 108 as they also seem cooperative, which aligns with my agreeableness trait (0.3).","O:1.0, C:0.6, E:0.6, A:0.3, N:0.1"
0,4,25.585786437626904,27.585786437626904,1,0.5710797721878751,0.5710797721878751,2.0,225.0,"As an extremely extraverted individual (1.0), I'm inclined to engage with others, and cooperating with a neighbor who is also cooperative seems like the most beneficial option given our mutual alignment. Given my high agreeableness (0.9), I prioritize building relationships over potential gains from defecting.","O:0.3, C:0.1, E:1.0, A:0.9, N:1.0"
0,5,17.435973903246527,43.81596199895819,1,0.6764158425487721,0.6764158425487721,4.0,153.0,"Given my high agreeableness (0.6), I am inclined to cooperate with nearby particles, especially those that are cooperating (like the particle at a distance of 2.24). Moving towards this cooperative neighbor allows me to strengthen our relationship and potentially increase our joint payoffs.","O:0.6, C:0.6, E:0.3, A:0.6, N:0.1"
0,6,23.23664424312258,49.42705098312484,1,0.31885257726935545,0.31885257726935545,3.0,126.0,"As a highly agreeable (0.8) and conscientious (0.7) individual, I tend to prioritize cooperation and stability. Given my current context, where most of my neighbors are cooperating, I will choose to cooperate as well, aiming to maintain a positive relationship with them while also considering the potential benefits of reciprocity.","O:0.0, C:0.7, E:0.3, A:0.8, N:0.1"
0,7,20.585786437626904,49.58578643762691,1,0.23189636584201656,0.23189636584201656,2.0,225.0,"Given my high agreeableness (0.9), I am inclined to cooperate with others. Considering my current strategy is to cooperate and my neighbor at a distance of 4.24 units in direction 225 degrees is defecting, I will try to move closer to them while maintaining cooperation. This approach aligns with my personality traits and allows me to potentially improve our interaction outcome.","O:0.5, C:0.0, E:0.4, A:0.9, N:0.2"
0,8,3.414213562373095,28.414213562373096,0,-0.009967805117294337,-0.009967805117294337,2.0,45.0,"Given my high neuroticism (1.0), I tend to prioritize self-preservation and maximizing immediate rewards. In this context, defecting seems like the optimal strategy as it allows me to reap potential benefits from nearby cooperators while minimizing risks associated with cooperation. This decision aligns with my extraversion (0.2) by taking bold action in a potentially uncertain environment.","O:0.4, C:0.1, E:0.2, A:0.6, N:1.0"
0,9,42.40482381480333,21.24651541284369,1,1.019385866275441,1.019385866275441,4.0,206.0,"My high extraversion trait encourages me to engage with others, and cooperating with a neighbor who is also cooperative (State of the neighbor: ""Cooperate"") seems like a beneficial strategy. Given my conscientiousness trait, I'm likely to follow social norms and reciprocate cooperation.","O:0.2, C:0.7, E:0.8, A:0.4, N:0.2"
0,10,43.74118095489748,33.965925826289066,1,-0.06896879270940537,-0.06896879270940537,1.0,105.0,"As a highly agreeable individual (0.9), I'm inclined to cooperate with others, especially those who are willing to do so (neighbor at 49 degrees). Considering my personality traits and the current context, I'll choose to move towards this cooperative neighbor while cooperating with them to maximize our shared payoff.","O:0.1, C:0.1, E:0.0, A:0.9, N:0.5"
0,11,31.16344427320205,44.97670446337147,1,-0.4665574863805706,-0.4665574863805706,3.0,161.0,"Given my high extraversion (0.9), I'm inclined to take risks and interact with others. In this context, cooperating with a neighbor who is also cooperating at a distance of 9.49 seems beneficial, as it may lead to mutual gains. This decision aligns with my agreeableness trait (0.9) and reflects my openness to interacting with others despite the risk of being exploited.","O:0.1, C:1.0, E:0.9, A:0.9, N:0.7"
0,12,37.5,8.0,0,0.3493007761897334,0.3493007761897334,2.5,180.0,"As a relatively high conscientiousness (0.8) and low agreeableness (0.2), I tend to prioritize self-interest over cooperation. Given the current context, with three cooperators nearby but one defector within interaction radius, defecting seems like the most beneficial strategy to maximize my payoff, while also considering the potential for future interactions with other agents.","O:0.3, C:0.8, E:0.7, A:0.2, N:0.1"
0,13,7.202411907401666,18.123257706421846,1,-0.525823624798199,-0.525823624798199,2.0,206.0,"Given my high agreeableness (0.8), I tend to prioritize cooperation and maintaining social relationships. In this context, despite one neighbor being a defector, the other is also defecting, suggesting a potential opportunity for cooperation with them both. My openness (0.6) allows me to consider multiple perspectives and adapt to the situation, while my conscientiousness (0.1) encourages me to weigh the risks and benefits of cooperating with these neighbors.","O:0.6, C:0.1, E:0.0, A:0.8, N:0.8"
0,14,48.49397023149584,24.19185573394539,1,-0.1571462642989836,-0.1571462642989836,5.0,26.0,"As an agent with high agreeableness (1.0), I tend to prioritize cooperation and harmony. In this context, my closest neighbor at a distance of 2.24 is also cooperative, which aligns with my desire for mutual benefit. Given the proximity and cooperative state of this neighbor, I decide to cooperate in order to strengthen our social bond and maximize payoffs through closer interaction.","O:0.0, C:0.3, E:0.4, A:1.0, N:0.5"
0,15,3.0,17.0,1,0.4172606610135907,0.4172606610135907,2.0,180.0,"As a conscientious individual (0.7), I tend to follow rules and maintain social norms, making cooperation a natural choice given my current state of defecting against a cooperator neighbor. This action also aligns with my agreeableness trait (0.6) by showing willingness to work together with others in the environment.","O:0.4, C:0.7, E:0.3, A:0.6, N:0.1"
0,16,35.0,20.0,1,2.049823776583258,2.049823776583258,2.0,0.0,"Given my high extraversion trait (1.0), I am inclined to engage with others and cooperate with nearby cooperators. In this context, there are three cooperative neighbors within my interaction radius of 10, particularly the neighbor at a distance of 1.0 that is already close by. To maximize my payoff, I will choose to Cooperate with them while moving closer to solidify our relationships.","O:0.1, C:0.4, E:1.0, A:0.2, N:0.0"
0,17,1.4142135623730951,41.41421356237309,0,-0.10504374552183698,-0.10504374552183698,2.0,45.0,"Given my high extraversion (1.0), I'm inclined to take bold actions and exploit opportunities for personal gain. In this context, defecting against both neighbors who are already defectors aligns with my personality traits, as it allows me to maximize my payoff by taking advantage of their vulnerability. This decision also responds to the current context, where both neighbors are at a distance within my interaction radius and have chosen to defect.","O:0.9, C:0.7, E:1.0, A:0.9, N:0.0"
0,18,18.0,15.0,0,0.7389242485565186,0.7389242485565186,3.0,180.0,"Given my high neuroticism (0.9), I'm inclined to take risks and prioritize personal gain. In this context, defecting against the two neighboring defectors aligns with my personality traits as it allows me to potentially gain a larger payoff by taking advantage of their lack of cooperation. My conscientiousness is also reflected in this decision as I've carefully considered the current strategy and neighbors' states before making a move.","O:0.7, C:1.0, E:0.3, A:0.8, N:0.9"
0,19,29.0,20.0,0,1.1199971327460199,1.1199971327460199,5.0,180.0,"Given my high neuroticism (1.0), I'm inclined to prioritize self-preservation and maximize gains. In this context, defecting against the two closest defecting neighbors will allow me to minimize losses while potentially attracting more cooperative neighbors that can offer better payoffs. My extraversion level (0.4) also suggests a desire for exploration and taking risks, which aligns with my decision to take advantage of the situation by defecting and moving closer to the remaining cooperators.","O:0.0, C:0.2, E:0.4, A:0.5, N:1.0"
0,20,24.414213562373096,26.414213562373096,1,0.7959532021339109,0.7959532021339109,2.0,45.0,"Given my high agreeableness (0.8), I am inclined to cooperate with my cooperative neighbor at a relatively close distance of 5.66 units. This action aligns with my personality trait and takes into account the information provided by the neighbor's state, which is ""Cooperate"".","O:1.0, C:0.0, E:0.3, A:0.8, N:0.1"
0,21,14.414213562373096,10.414213562373096,0,0.09751306134158894,0.09751306134158894,2.0,45.0,"Given my high conscientiousness (0.5), I'm inclined to make cautious decisions, which aligns with defecting in this context where both neighbors are defecting. I'm moving towards the cooperating neighbor at a moderate distance (2) and direction (45 degrees) to maintain a safe distance while observing their behavior.","O:0.2, C:0.5, E:0.1, A:0.5, N:0.0"
0,22,26.5,44.598076211353316,1,0.3146784118209539,0.3146784118209539,3.0,120.0,"Given my high openness trait, I'm inclined to explore opportunities for cooperation. Considering my current strategy is Defect and there are multiple cooperating neighbors within my interaction radius, I choose to cooperate with the closest cooperators (5.83 units away) in direction 120 degrees, aiming to improve my payoff by moving closer to them while avoiding a potential severe loss from defecting against them. This decision aligns with my agreeableness trait and takes into account neighboring agents' information.","O:1.0, C:1.0, E:1.0, A:0.5, N:0.8"
0,23,39.3269804274349,41.36197149921864,1,0.2737298016540832,0.2737298016540832,3.0,153.0,"Given my high extraversion (0.8) and agreeableness (0.8), I'm inclined to cooperate with others, especially when faced with a cooperative neighbor. Considering the nearest cooperative neighbor is at a distance of 8.94 units and in a direction of 153 degrees, I choose to move towards this particle while cooperating with it, which aligns with my personality traits and responds to the current context by potentially yielding moderate payoffs.","O:0.2, C:0.7, E:0.8, A:0.8, N:0.5"
0,24,19.0,46.0,0,0.7171064778883616,0.7171064778883616,3.0,90.0,"Given my high neuroticism (0.7), I'm inclined to prioritize self-interest and maximize short-term gains. In this context, defecting against cooperators like the neighbor at a distance of 5.0 units with a direction of 90 degrees appears advantageous, as it offers a chance to receive a large payoff while minimizing losses. This decision also takes into account my moderate openness (0.4), which suggests I'm willing to adapt and exploit opportunities in this dynamic environment.","O:0.4, C:0.3, E:0.6, A:0.3, N:0.7"
0,25,21.121320343559642,0.1213203435596455,1,2.16295147860316,2.16295147860316,3.0,45.0,"Given my high extraversion (0.9) and agreeableness (0.5), I'm inclined to cooperate with others. Considering the close proximity of multiple cooperative neighbors within the interaction radius, cooperating will allow me to reap moderate payoffs while potentially improving relationships with these agents. This decision also takes into account the severe loss associated with defecting against cooperators.","O:0.3, C:0.0, E:0.9, A:0.5, N:0.7"
0,26,26.0,45.46410161513776,1,1.9864498944930726,1.9864498944930726,4.0,120.0,"As a highly conscientious (0.8) agent, I tend to prioritize cooperation and stability in my interactions. Considering the current context, where most neighbors are cooperating, I will choose to cooperate with them to maintain harmony and maximize our collective payoff, especially since one of my closest neighbors is defecting, which might lead to further loss if I don't adapt my strategy.","O:0.4, C:0.8, E:0.3, A:0.0, N:0.7"
0,27,38.37626492754672,5.934442802201417,1,-0.24440834318260088,-0.24440834318260088,3.0,102.0,"Given my high extraversion (1.0), I'm inclined to engage with others, especially those who cooperate. In this context, moving towards the cooperative neighbor at a 102-degree angle allows me to potentially benefit from their cooperation and improve our mutual payoff. My openness (0.6) also suggests that I'm adaptable and willing to adjust my strategy based on new information, which in this case is the presence of a cooperative neighbor within my interaction radius.","O:0.6, C:0.7, E:1.0, A:0.4, N:0.9"
0,28,9.0,31.0,0,-0.1624625113399398,-0.1624625113399398,0.0,0.0,No movement due to LLM processing error. Current state maintained.,"O:0.0, C:0.4, E:0.9, A:1.0, N:0.1"
0,29,41.17157287525381,7.82842712474619,1,0.2709774287947546,0.2709774287947546,4.0,135.0,"My high conscientiousness (0.8) suggests a tendency to follow established strategies and maintain relationships. In this context, cooperating with the cooperative neighbor at a distance of 9.9 aligns with this trait, potentially yielding moderate payoffs while maintaining social relationships.","O:0.5, C:0.8, E:0.1, A:0.2, N:0.7"
1,0,36.69464165539854,17.685346440313115,1,1.8185110378060498,1.2890403826431183,3.0,135.0,"Given my high extraversion (1.0) and agreeableness (0.8), I tend to be outgoing and cooperative. In this context, since most of the neighbors are cooperators within my interaction radius, I will cooperate with them to maintain social relationships and potentially gain benefits from their cooperation. This decision also aligns with my openness (0.7) as I am willing to engage with others in a collaborative manner.","O:0.7, C:0.0, E:1.0, A:0.8, N:0.3"
1,1,36.36608289495492,18.516011703836273,1,2.3572082329589064,2.0759335102516068,2.0,90.0,"Given my high openness (0.7) and agreeableness (0.7), I tend to favor cooperation in social situations. In this context, with four out of six neighbors being cooperative and within the interaction radius, it is advantageous to cooperate and move closer to these beneficial particles while minimizing losses from defecting neighbors.","O:0.7, C:0.3, E:0.5, A:0.7, N:0.1"
1,2,17.522972362717415,16.300741279491604,0,-0.6292432360723271,-0.8720028912826594,3.0,111.0,"As an individual high in extraversion (0.8) and low in openness (0.1), I tend to be more assertive and less adaptable. Given the current context, where both neighbors are defecting, I decide to defect as well to maintain a consistent strategy and avoid potential losses from cooperating with uncooperative neighbors. This decision also reflects my agreeableness trait (0.5), as I am willing to cooperate but only when reciprocated by others.","O:0.1, C:0.7, E:0.8, A:0.5, N:0.3"
1,3,26.19278158375405,26.868403837656526,1,2.1351177699694865,1.7554883523617397,4.0,130.0,"Given my high openness trait (1.0), I am inclined to explore and interact with cooperative neighbors. In this context, I will choose to cooperate with the neighbor at a distance of 4.94 units in the direction of 130 degrees, as it has a cooperative state and is within my interaction radius. This decision aligns with my openness trait by allowing me to engage with other cooperative agents and potentially increase mutual payoffs.","O:1.0, C:0.6, E:0.6, A:0.3, N:0.1"
1,4,24.17157287525381,26.17157287525381,0,5.178192625875694,4.607112853687818,2.0,225.0,"Given my high extraversion trait (1.0), I tend to be outgoing and sociable, which aligns with cooperating with other particles in close proximity (distance of 1.66). Considering the current context, I will cooperate with the nearest particle that cooperates, as it is beneficial for both parties and maximizes our mutual payoff.","O:0.3, C:0.1, E:1.0, A:0.9, N:1.0"
1,5,17.435973903246527,40.81596199895819,1,0.8104459346303348,0.1340300920815627,3.0,270.0,"Given my high openness and agreeableness traits (0.6), I am inclined to cooperate with others, especially since most of my neighbors are cooperators (5 out of 6). Considering the current context, where all but one neighbor is a cooperator, it's beneficial for me to maintain a cooperative stance to foster positive interactions and potentially gain larger payoffs by moving closer to these cooperative particles.","O:0.6, C:0.6, E:0.3, A:0.6, N:0.1"
1,6,21.23664424312258,49.42705098312484,0,4.724175252069765,4.405322674800409,2.0,180.0,"Given my high agreeableness (0.8), I tend to prioritize cooperation. Considering my current context, most neighbors are cooperating, and only one is defecting. Therefore, I will continue cooperating with them while moving slightly away from the defector at a moderate distance of 2 units in the opposite direction (180 degrees). This approach aligns with my personality traits by promoting mutual benefit and reducing conflict.","O:0.0, C:0.7, E:0.3, A:0.8, N:0.1"
1,7,22.0,1.0,1,0.5601442343979165,0.32824786855589994,2.0,45.0,"Given my high agreeableness trait (0.9), I am inclined to cooperate with neighboring particles. Considering the current context, where four out of six neighbors are cooperating, it is likely beneficial to maintain this cooperative relationship and move closer to them, as indicated by my small movement in a direction towards one of these cooperators. This approach aligns with my personality traits while responding to the current context by prioritizing cooperation over potential gains from defecting against a single defector.","O:0.5, C:0.0, E:0.4, A:0.9, N:0.2"
1,8,1.882124676135139,27.128638343000016,0,0.17885106976278797,0.1888188748800823,2.0,220.0,"Given my high level of agreeableness (0.6), I am inclined to cooperate with others; however, in this context, cooperating with a neighbor who defects may result in a significant loss for me. My high neuroticism (1.0) also makes me more sensitive to potential losses, leading me to defect and minimize the risk of being exploited by my neighbors.","O:0.4, C:0.1, E:0.2, A:0.6, N:1.0"
1,9,39.40482381480333,21.24651541284369,1,1.9690001615264747,0.9496142952510338,3.0,180.0,"My high conscientiousness (0.7) suggests I prioritize stability and cooperation. Given all neighbors are cooperative, I will maintain this cooperative strategy to maximize payoff from beneficial relationships while keeping my distance due to the large interaction radius.","O:0.2, C:0.7, E:0.8, A:0.4, N:0.2"
1,10,42.24118095489748,36.56400203764238,1,0.14479583851184197,0.21376463122124734,3.0,120.0,"Given my high agreeableness trait (0.9), I am inclined to cooperate and maintain a harmonious relationship with my neighbor. Considering our proximity (8.61 units) and cooperative state, it's beneficial for both of us to continue cooperating, which aligns with my personality traits and the current context.","O:0.1, C:0.1, E:0.0, A:0.9, N:0.5"
1,11,27.699342658064296,46.97670446337147,1,0.5113826304997432,0.9779401168803138,4.0,150.0,"As an agent with high conscientiousness and agreeableness (traits valued at 1.0 and 0.9 respectively), I tend to prioritize cooperation and maintain social harmony. Considering my current state and neighboring agents' information, I will choose to cooperate with the neighbor closest to me in direction (150 degrees) as indicated by their proximity (4.68 units). This decision reflects my agreeable nature while also being mindful of my strategic positioning within the interaction radius.","O:0.1, C:1.0, E:0.9, A:0.9, N:0.7"
1,12,38.623819780247736,5.218448436299638,0,2.5811263406496705,2.231825564459937,3.0,292.0,"As a highly conscientious agent (0.8), I tend to prioritize stability and predictability in my actions. Given that all neighboring agents are cooperators, and considering the relatively close distance between us, cooperating with them seems like a safe choice. This decision also aligns with my extraversion trait (0.7) as it allows me to build relationships with others while minimizing potential losses.","O:0.3, C:0.8, E:0.7, A:0.2, N:0.1"
1,13,5.261820454849674,17.639413915222512,1,0.11210100516005805,0.637924629958257,2.0,194.0,"Given my high agreeableness (0.8), I tend to prioritize cooperation and maintaining social relationships. In this context, with a cooperative neighbor nearby, it's beneficial for me to continue cooperating to maintain our mutual benefits and strengthen our relationship, which is in line with my personality traits.","O:0.6, C:0.1, E:0.0, A:0.8, N:0.8"
1,14,46.68135465742254,23.34661921046399,1,-0.06686774027076436,0.09027852402821923,2.0,205.0,"As an agent with high agreeableness (1.0), I tend to prioritize cooperation and harmony in social interactions. Given my neighbor at a distance of 6.76 in direction 205 is cooperating, it's beneficial for me to cooperate as well, increasing the chances of mutual benefits within our interaction radius of 10.","O:0.0, C:0.3, E:0.4, A:1.0, N:0.5"
1,15,2.9999999999999996,15.0,1,0.7624884629161048,0.3452278019025141,2.0,270.0,"Given my high conscientiousness (0.7), I aim to maintain a cooperative stance while strategically positioning myself for potential benefits. With two cooperators nearby, and considering the moderate distance from one of them, I choose to cooperate with both neighbors, as it aligns with my agreeableness trait (0.6) and might yield a moderate payoff.","O:0.4, C:0.7, E:0.3, A:0.6, N:0.1"
1,16,33.0,20.0,1,2.634268566431195,0.5844447898479368,2.0,180.0,"As an extraverted individual (extraversion: 1.0), I'm inclined to interact and cooperate with others, particularly when they're cooperative. In the current context, four neighboring particles are cooperating, indicating a high level of cooperation in this environment. Given my personality traits, it's in line with my nature to align myself with these cooperators and build positive relationships.","O:0.1, C:0.4, E:1.0, A:0.2, N:0.0"
1,17,1.4142135623730947,39.41421356237309,0,0.040704029633190975,0.14574777515502796,2.0,270.0,"Given my high extraversion and agreeableness traits, I'm inclined to take bold action and maintain a defect strategy. However, considering the absence of neighboring agents and my current defect strategy, I'll move towards an angle that doesn't directly oppose any potential future interactions while maintaining a cautious approach.","O:0.9, C:0.7, E:1.0, A:0.9, N:0.0"
1,18,18.7167358990906,13.132839147005596,1,0.09948828982660318,-0.6394359587299154,2.0,291.0,"Given my high conscientiousness (1.0), I tend to adhere to rules and consider long-term benefits. In this context, cooperating with the nearby cooperator is beneficial as it allows me to maintain a positive relationship and potentially gain more from them in the future. My relatively low extraversion (0.3) also suggests that I prefer to maintain existing relationships rather than seeking new ones, which aligns with my decision to cooperate with the nearby agent.","O:0.7, C:1.0, E:0.3, A:0.8, N:0.9"
1,19,26.0,20.0,1,1.305165084000844,0.18516795125482413,3.0,180.0,"Given my high neuroticism (1.0), I'm inclined to cooperate as a defensive measure. However, considering my moderate extraversion (0.4) and agreeableness (0.5), I also want to benefit from the cooperation of others. With four cooperative neighbors within my interaction radius, it's in my best interest to cooperate with them and move closer to maximize our mutual payoffs, especially since two of these neighbors are at a relatively close distance (3.81 and 6.0).","O:0.0, C:0.2, E:0.4, A:0.5, N:1.0"
1,20,26.535533905932738,28.535533905932738,1,1.2524638737695373,0.45651067163562636,3.0,45.0,"My high openness to experience suggests I am inclined to explore and cooperate with like-minded neighbors, such as the two cooperators within my interaction radius. Considering the closer neighbor (1.66 units away) is also a cooperator, I will choose to cooperate to strengthen our social bond and maximize our mutual payoff, which aligns with my agreeableness trait.","O:1.0, C:0.0, E:0.3, A:0.8, N:0.1"
1,21,16.032247551122992,11.589784066958043,1,0.22196944557241288,0.12445638423082395,2.0,36.0,"Given my high agreeableness (0.5), I tend to prioritize harmony and cooperation. In this context, cooperating with the cooperative neighbor at a distance of 5.2, which is within our interaction radius, aligns with my personality traits.","O:0.2, C:0.5, E:0.1, A:0.5, N:0.0"
