time,agent_id,x,y,state,score,payoff,action_magnitude,action_direction,reasoning,personality
0,0,38.36197149921864,14.673019572565103,1,1.382075792732137,1.382075792732137,3.0,63.0,"Given my high extraversion (1.0) and agreeableness (0.8), I'm inclined to cooperate with those who are cooperative, which is the case for two of my neighbors at a relatively close distance (2.24 and 8.54 units). This decision aligns with my personality traits by prioritizing social harmony and cooperation over potential gains from defecting.","O:0.7, C:0.0, E:1.0, A:0.8, N:0.3"
0,1,35.878679656440355,16.121320343559642,1,0.09940005355239284,0.09940005355239284,3.0,135.0,"Given my high openness and agreeableness traits, I tend to prioritize cooperation over individual gain. In this context, I notice that two of my neighbors are cooperating (one at a relatively close distance of 2.24), so I choose to cooperate with them while moving towards one of these cooperative neighbors.","O:0.7, C:0.3, E:0.5, A:0.7, N:0.1"
0,2,13.878679656440358,14.121320343559642,0,0.0984376660708722,0.0984376660708722,3.0,135.0,"Given my high extraversion (0.8), I tend to take risks and seek opportunities for gain. In this context, defecting against cooperators may yield a large payoff, which aligns with my personality traits. I also consider the distance between me and neighboring particles; moving towards the nearest cooperator at 5.83 units could lead to potential benefits, but I prioritize maximizing my payoff by defecting in this case.","O:0.1, C:0.7, E:0.8, A:0.5, N:0.3"
0,3,30.0,24.0,0,0.6279938219719511,0.6279938219719511,4.0,90.0,"Given my moderately high conscientiousness (0.6) and low neuroticism (0.1), I prioritize caution and stability in decision-making. Considering the neighbors' states and distances, I choose to defect against the cooperators at a distance of 9.49 and 8.6 units, which may yield larger payoffs due to the temptation payoff structure.","O:1.0, C:0.6, E:0.6, A:0.3, N:0.1"
0,4,24.878679656440358,26.878679656440358,1,0.23038245969894566,0.23038245969894566,3.0,225.0,"As an extremely extraverted AI, I'm inclined to interact and cooperate with others. Considering my neighbor at a distance of 5.66 is cooperating, I'll move towards them (direction 225) with moderate speed (magnitude 3) while adopting the strategy of cooperation. This decision aligns with my agreeable nature and responsiveness to beneficial interactions in the current context.","O:0.3, C:0.1, E:1.0, A:0.9, N:1.0"
0,5,19.217986951623264,42.90798099947909,0,5.855345505463649,5.855345505463649,2.0,153.0,"Given my personality traits, particularly high openness (0.6) and agreeableness (0.6), I'm inclined to take a calculated risk by defecting in response to the mixed cooperative and defective behavior of nearby particles. This decision also considers the current context, where two cooperators are at a distance that doesn't justify moving closer, but one defector is nearby, suggesting an opportunity for exploitation.","O:0.6, C:0.6, E:0.3, A:0.6, N:0.1"
0,6,23.23664424312258,49.42705098312484,1,0.00040901041392135684,0.00040901041392135684,3.0,126.0,"Given my high agreeableness trait (0.8), I prioritize cooperation to maintain social harmony and potentially benefit from reciprocity. In this context, two of the six neighbors are cooperators within my interaction radius, so it's beneficial for me to cooperate with them to maximize our shared payoffs, considering their proximity (5.0 and 6.08 units away) and cooperative states.","O:0.0, C:0.7, E:0.3, A:0.8, N:0.1"
0,7,20.585786437626904,49.58578643762691,1,-0.1413672292255752,-0.1413672292255752,2.0,225.0,"As an agent with high agreeableness (0.9) and moderate extraversion (0.4), I tend to prioritize cooperation over competition. In the current context, where all neighbors are cooperators within my interaction radius, it's beneficial to maintain a cooperative strategy to maximize payoffs from these relationships.","O:0.5, C:0.0, E:0.4, A:0.9, N:0.2"
0,8,0.0,27.0,0,0.20735325861022608,0.20735325861022608,2.0,180.0,"Given my high neuroticism (1.0), I'm inclined to prioritize self-interest and defect, especially when faced with multiple potential cooperators. Considering the current context, where two out of three neighbors are defecting or cooperative, defecting seems like a more profitable option for me. My agreeableness (0.6) suggests that I might be willing to cooperate if it benefits others, but in this case, my neuroticism takes precedence.","O:0.4, C:0.1, E:0.2, A:0.6, N:1.0"
0,9,44.20241190740167,22.123257706421846,1,5.018724736647258,5.018724736647258,2.0,206.0,"My high extraversion (0.8) and agreeableness (0.4) traits lead me to prioritize cooperation, especially when I'm near a cooperative neighbor at a relatively close distance of 2.24 units. Considering my current state and the presence of a cooperating neighbor, it's beneficial to maintain this relationship and potentially improve our mutual payoff by moving closer.","O:0.2, C:0.7, E:0.8, A:0.4, N:0.2"
0,10,46.62423611596203,36.018838320891085,1,-0.11814676461593054,-0.11814676461593054,4.0,49.0,"Given my high agreeableness trait (0.9), I am inclined to cooperate with others to maintain social harmony and improve relationships. In this context, I will cooperate with the nearest neighbor that is cooperating (distance of 9.22) and move towards them in their direction, as it seems like a safer choice considering our shared state.","O:0.1, C:0.1, E:0.0, A:0.9, N:0.5"
0,11,30.217925697602734,45.30227261782863,1,-0.5056126693866942,-0.5056126693866942,4.0,161.0,"Given my high extraversion (0.9) and agreeableness (0.9), I'm inclined to cooperate with my neighbor at a close distance (6.32 units), as it aligns with my social orientation. This decision also considers the cooperative state of this neighbor, which could lead to mutual benefits.","O:0.1, C:1.0, E:0.9, A:0.9, N:0.7"
0,12,38.82442949541505,9.618033988749895,1,0.3811230395577112,0.3811230395577112,2.0,126.0,"Given my high conscientiousness (0.8), I prioritize making decisions that benefit both myself and others. In this context, cooperating with the two cooperators at distances of 5.0 and 6.32 will yield moderate payoffs, which aligns with my desire for stability and responsibility. Additionally, moving closer to these cooperative neighbors allows me to potentially gain larger benefits in future interactions.","O:0.3, C:0.8, E:0.7, A:0.2, N:0.1"
0,13,6.303617861102499,17.68488655963277,0,-0.7985348198032753,-0.7985348198032753,3.0,206.0,"Given my high neuroticism (0.8), I'm prone to taking risks and prioritizing self-interest. In this context, both neighbors are defecting, which suggests a lack of cooperation in the environment. Therefore, I'll adopt a similar strategy by defecting as well, aiming to maximize my payoff despite the potential loss from others' defects.","O:0.6, C:0.1, E:0.0, A:0.8, N:0.8"
0,14,45.79758809259833,22.876742293578154,1,0.4593928320735554,0.4593928320735554,2.0,26.0,"As a highly agreeable individual (agreeableness = 1.0), I am inclined to cooperate with my neighbors, especially those that are already cooperative (State of the neighbor: ""Cooperate""). Given my current position and the proximity of the nearest cooperative neighbor at a distance of 2.24 units, I will move towards them in the direction they are located (26 degrees) while choosing to cooperate as it aligns with my personality traits and promotes mutual benefit.","O:0.0, C:0.3, E:0.4, A:1.0, N:0.5"
0,15,5.17364817766693,16.01519224698779,0,-0.6082542639184955,-0.6082542639184955,1.0,280.0,"As a highly conscientious agent (0.7), I prioritize optimizing my payoff by defecting against cooperators to avoid sucker's payoff. Given the neighbor is cooperating and within interaction radius (4.47 < 10), it's beneficial for me to defect despite being somewhat agreeable (0.6).","O:0.4, C:0.7, E:0.3, A:0.6, N:0.1"
0,16,31.0,20.0,0,0.9032617507641776,0.9032617507641776,2.0,180.0,"Given my high extraversion (1.0), I tend to take bold actions and pursue opportunities for gain. In this context, defecting against a nearby defector will yield me a larger payoff than cooperating with them. This decision aligns with my personality trait of being outgoing and seeking benefits from interactions.","O:0.1, C:0.4, E:1.0, A:0.2, N:0.0"
0,17,46.0,40.0,0,0.09741145058761008,0.09741145058761008,4.0,180.0,"Given my high extraversion trait (1.0), I'm inclined to take bold actions that maximize my payoff. Considering the neighbors' states are ""Defect"", cooperating would likely result in a sucker's payoff. Therefore, defecting seems like the more profitable strategy in this context, allowing me to potentially gain a larger payoff and move closer to beneficial particles in future rounds.","O:0.9, C:0.7, E:1.0, A:0.9, N:0.0"
0,18,19.0,11.535898384862247,0,-0.3278274196169727,-0.3278274196169727,4.0,240.0,"My high neuroticism (0.9) and agreeableness (0.8) suggest I tend to be cautious and empathetic, but my current context shows neighboring agents are defecting. Given the high distance and angle between me and these neighbors, it's unlikely that cooperating will lead to a significant payoff improvement. Therefore, I decide to defect to minimize potential losses while exploring other opportunities.","O:0.7, C:1.0, E:0.3, A:0.8, N:0.9"
0,19,31.0,20.0,0,-9.563404915902488,-9.563404915902488,3.0,180.0,"Given my high neuroticism (1.0), I am more prone to taking risks and seeking self-preservation in uncertain environments. In this context, with a neighboring agent defecting at close proximity (1.0) and another cooperating at a moderate distance (7.21), I will choose to defect to protect myself from potential losses while also potentially benefiting from the temptation payoff if others follow suit.","O:0.0, C:0.2, E:0.4, A:0.5, N:1.0"
0,20,25.121320343559642,27.121320343559642,1,2.991039031710167,2.991039031710167,3.0,45.0,"Given my high openness (1.0) and agreeableness (0.8), I'm inclined to cooperate with a neighbor that has also chosen to cooperate (State of the neighbor: ""Cooperate""), despite its moderate distance (5.66). This choice aligns with my personality traits, as it promotes cooperation and harmony.","O:1.0, C:0.0, E:0.3, A:0.8, N:0.1"
0,21,14.414213562373096,10.414213562373096,0,-0.47880131238228485,-0.47880131238228485,2.0,45.0,"As a highly conscientious individual (0.5), I prioritize self-preservation and seek to maximize my payoff. Given that both neighbors are defecting, it's optimal for me to also defect in this round, considering the current context where cooperation would lead to severe losses. This decision is consistent with my agreeableness trait (0.5), as I'm willing to reciprocate the defection of others while maintaining a cautious approach.","O:0.2, C:0.5, E:0.1, A:0.5, N:0.0"
0,22,28.0,44.0,0,0.3290924878060121,0.3290924878060121,2.0,90.0,"Given my high level of neuroticism (0.8), I'm inclined to prioritize self-interest and defect against cooperators. In this context, the close-by defector neighbor at a distance of 0.0 presents an opportunity for me to gain a large payoff by matching their strategy. My openness trait encourages exploration, but in this case, it's better to exploit the situation rather than taking risks with unknown outcomes.","O:1.0, C:1.0, E:1.0, A:0.5, N:0.8"
0,23,40.21798695162327,40.90798099947909,1,-0.073207065932033,-0.073207065932033,2.0,153.0,"Based on my high extraversion (0.8), I'm inclined to interact and cooperate with others, especially those who are cooperative (State of the neighbor: ""Cooperate""). Considering the current context, I'll move towards the cooperating neighbor at a moderate distance to potentially gain a better payoff, while also taking into account my agreeableness trait (0.8) to maintain social harmony.","O:0.2, C:0.7, E:0.8, A:0.8, N:0.5"
0,24,19.0,45.0,0,-0.5076071328608622,-0.5076071328608622,2.0,90.0,"Based on my high neuroticism (0.7), I'm inclined to prioritize self-preservation and avoid potential losses from cooperators. Given that three out of six neighbors are defectors and one is a cooperator at a relatively close distance (2.24), it's reasonable to adopt a cautious approach by defecting and potentially exploiting the cooperative neighbor, while also considering moving towards the nearest defector to further minimize risks and losses.","O:0.4, C:0.3, E:0.6, A:0.3, N:0.7"
0,25,21.82842712474619,0.8284271247461916,0,1.1184248751309798,1.1184248751309798,4.0,45.0,"My high extraversion trait (0.9) suggests I'm inclined to take risks and pursue rewards, making me more likely to defect against cooperators. Given the current context, with multiple cooperators at varying distances, my strategy is to defect in order to maximize potential payoffs while also moving closer to one of the cooperators that is relatively close (4.24 distance). This decision allows me to potentially reap a larger payoff while still considering the proximity and cooperative nature of some neighbors.","O:0.3, C:0.0, E:0.9, A:0.5, N:0.7"
0,26,27.0,43.732050807568875,0,-0.5737445067507136,-0.5737445067507136,2.0,120.0,"Considering my high conscientiousness (0.8), I aim to maximize my payoff by exploiting cooperative neighbors. Given my relatively low openness (0.4) and high neuroticism (0.7), I'm inclined to defect against cooperators, especially when they're close, like the ones at 5.83 and 6.32 units away.","O:0.4, C:0.8, E:0.3, A:0.0, N:0.7"
0,27,39.62373507245328,5.934442802201417,0,0.842840059609621,0.842840059609621,3.0,78.0,"Given my high neuroticism (0.9), I'm inclined to prioritize self-interest and defect against a neighbor that has cooperated in the past. This decision aligns with my personality traits as it reflects a somewhat aggressive and risk-taking approach, which is consistent with my high extraversion (1.0) and neuroticism scores. The current context suggests that defecting against a cooperator may yield a larger payoff, especially considering the neighbor's distance (5.1) and state of cooperation.","O:0.6, C:0.7, E:1.0, A:0.4, N:0.9"
0,28,5.501521171442416,29.06076151901465,0,-0.1702180718801076,-0.1702180718801076,4.0,209.0,"Due to high extraversion (0.9), I tend to take bold and outgoing actions. Given the neighbor is also defecting (State of the neighbor: ""Defect"") within my interaction radius (10), it's beneficial for me to maintain this strategy as it aligns with my agreeableness trait (1.0) to reciprocate similar behavior and avoid potential losses from cooperation.","O:0.0, C:0.4, E:0.9, A:1.0, N:0.1"
0,29,41.878679656440355,7.121320343559643,1,-0.06191574500964142,-0.06191574500964142,3.0,135.0,"Given my conscientiousness (0.8), I will likely choose a strategy that aligns with long-term benefits, such as cooperating with the cooperative neighbor. Considering the current context and my openness (0.5) towards exploring new interactions, I will move closer to this cooperative neighbor at a moderate distance of 3 units in the direction of 135 degrees, while maintaining cooperation to potentially increase our joint payoff.","O:0.5, C:0.8, E:0.1, A:0.2, N:0.7"
1,0,35.53354437447245,11.844592447818913,1,1.6559536790696572,0.2738778863375201,4.0,225.0,"Given my high extraversion (1.0), I am inclined to engage in social interactions and cooperate with others. Considering the current context, four out of seven neighbors are cooperators within the interaction radius, which suggests a cooperative environment. Therefore, I will choose to cooperate while moving closer to one of the cooperators at a moderate distance.","O:0.7, C:0.0, E:1.0, A:0.8, N:0.3"
1,1,38.45018155854669,14.576206118829479,1,0.4825346113854347,0.38313455783304184,3.0,329.0,"Given my high agreeableness (0.7) and openness (0.7), I tend to cooperate with others, even if it means risking a potential loss in the short term. In this context, I'm already near a cooperative neighbor at a distance of 2.87, so moving towards them is beneficial and aligns with my personality traits.","O:0.7, C:0.3, E:0.5, A:0.7, N:0.1"
1,2,14.43537206028062,10.160248068593361,0,-4.035267967607198,-4.13370563367807,4.0,278.0,"Given my high level of extraversion (0.8) and conscientiousness (0.7), I am inclined to take bold action. Considering the current context, where all neighboring particles are defecting, I will maintain my initial strategy of defecting to minimize losses and potentially exploit their cooperation in the future. My decision also takes into account the proximity of the nearest defector at 3.75 units away, which motivates me to move closer to them.","O:0.1, C:0.7, E:0.8, A:0.5, N:0.3"
1,3,28.26794919243112,25.0,0,1.0071715569518926,0.3791777349799415,2.0,150.0,"Given my moderate level of conscientiousness (0.6), I will maintain a cautious approach by defecting against cooperators while moving closer to them (magnitude = 2). This strategy aligns with my personality traits as it balances exploration and exploitation. In the current context, I am aware that there are two cooperators at a moderate distance, which may provide opportunities for future cooperation or exploitation, but for now, defecting seems like the safest option to maintain some level of control over interactions while getting closer to them.","O:1.0, C:0.6, E:0.6, A:0.3, N:0.1"
1,4,27.0,29.0,1,0.10824679647195345,-0.12213566322699221,3.0,45.0,"Given my high extraversion (1.0) and neuroticism (1.0), I tend to be impulsive and reactive. In this context, with three defecting neighbors at a safe distance and one cooperating neighbor close by, I choose to defect to potentially gain a larger payoff from the nearby cooperator and avoid losses from the distant defectors.","O:0.3, C:0.1, E:1.0, A:0.9, N:1.0"
1,5,18.95651972338029,45.89656509375433,0,4.937258206020834,-0.9180872994428158,3.0,95.0,"Given my high openness (0.6) and agreeableness (0.6), I may initially consider cooperation. However, considering my current strategy is ""Defect"" and the neighboring particles' states are mostly ""Defect"", I choose to maintain this strategy for now. The nearby cooperators at a relatively close distance (7.66 and 6.82) suggest that defecting might be beneficial in terms of payoff, aligning with my neuroticism's low level (0.1), indicating resilience to losses.","O:0.6, C:0.6, E:0.3, A:0.6, N:0.1"
1,6,20.243952092343108,49.63632040435722,0,2.8706949507266826,2.8702859403127614,3.0,176.0,"Given my agreeableness (0.8) and openness (0.0), I lean towards cooperation. Since a neighbor is already cooperating (State of the neighbor: ""Cooperate"") at a close distance (2.66), it's beneficial to reciprocate to maintain a positive relationship and maximize payoff.","O:0.0, C:0.7, E:0.3, A:0.8, N:0.1"
1,7,19.5597260076499,46.766708575269185,0,-2.416400838582256,-2.2750336093566808,3.0,250.0,"Given my high agreeableness (0.9) and relatively low openness (0.5), I tend to prioritize cooperation but also acknowledge the importance of self-preservation. In this context, with multiple defecting neighbors and only one cooperating neighbor at a considerable distance, it's rational for me to defect to minimize losses, especially considering my low conscientiousness (0.0) which suggests a lack of adherence to rules or norms. My decision to move towards the cooperater is also influenced by my moderate extraversion (0.4), indicating I'm inclined to engage with others but in this case, it's not feasible given their distance and behavior.","O:0.5, C:0.0, E:0.4, A:0.9, N:0.2"
1,8,48.0,27.0,1,0.6226302812095745,0.41527702259934846,2.0,180.0,"Given my high agreeableness (0.6), I tend to prioritize cooperation and building relationships. In this context, I see three cooperative neighbors at relatively close distances, which aligns with my personality trait. To maximize payoff, I'll choose to cooperate and move towards one of the cooperators (magnitude 2 in a direction that brings me closer to them, 180 degrees).","O:0.4, C:0.1, E:0.2, A:0.6, N:1.0"
1,9,45.734500793639626,23.408832925794925,1,7.540908428187407,2.5221836915401497,2.0,40.0,"My high level of conscientiousness suggests I will prioritize cooperation to maintain social harmony and minimize conflict. Given that one neighbor is defecting (State of the neighbor: ""Defect"") and another is cooperating (State of the neighbor: ""Cooperate""), I decide to cooperate with the closer cooperative neighbor, as it aligns with my agreeableness trait, while also considering the potential benefits of a cooperative relationship with this particular neighbor.","O:0.2, C:0.7, E:0.8, A:0.4, N:0.2"
1,10,46.62423611596203,36.018838320891085,0,-0.03911849177555507,0.07902827284037547,0.0,180.0,"Given my high level of agreeableness (0.9), I'm inclined to defect against a neighbor that has chosen to defect, as this action aligns with my personality trait of being cooperative but not overly trusting. Considering the current context, where two neighboring agents are defectors and one is a cooperator, defecting against the defector at a distance of 4.03 (98 degrees) seems like a strategic move to maximize my payoff.","O:0.1, C:0.1, E:0.0, A:0.9, N:0.5"
1,11,26.75382408246498,43.30227261782863,0,-3.818998917264226,-3.3133862478775318,4.0,210.0,"Given my high extraversion (0.9), I'm inclined to interact with neighbors who may offer larger payoffs. In this case, the two defecting neighbors are closer and could provide a higher payoff if I defect against them. My conscientiousness trait (1.0) also suggests that I should be strategic in my decision-making, which aligns with choosing to defect against potentially beneficial neighbors.","O:0.1, C:1.0, E:0.9, A:0.9, N:0.7"
1,12,37.32442949541505,12.216110200103211,0,1.7373453994802728,1.3562223599225616,3.0,120.0,"My high conscientiousness and agreeableness traits suggest that I prioritize cooperation and maintaining social relationships. Given the proximity of multiple cooperators (2 at 5.08 and 7.14 units away), it's advantageous to maintain a cooperative stance to maximize mutual benefits while moving closer to these beneficial particles, which aligns with my extraversion trait.","O:0.3, C:0.8, E:0.7, A:0.2, N:0.1"
1,13,4.009312115698313,14.408278382476803,0,-1.3024650135677196,-0.5039301937644441,4.0,235.0,"Given my high neuroticism (0.8), I'm inclined to prioritize self-preservation and take a risk-averse approach. In this context, defecting against the neighbor at a close distance of 2.02 units aligns with my personality traits, as it allows me to minimize potential losses.","O:0.6, C:0.1, E:0.0, A:0.8, N:0.8"
1,14,42.172356944451735,21.186269246615357,1,1.0491628734462064,0.589770041372651,4.0,205.0,"Given my high agreeableness trait (1.0), I'm inclined to cooperate with others, especially when a neighbor is cooperative (State of the neighbor: ""Cooperate""). This decision also takes into account the proximity and direction to the cooperative neighbor within my interaction radius, which suggests a beneficial interaction.","O:0.0, C:0.3, E:0.4, A:1.0, N:0.5"
1,15,7.467953923071114,19.29180042414376,0,-0.8757123043838183,-0.26745804046532284,4.0,55.0,"Given my high conscientiousness (0.7) and low extraversion (0.3), I tend to be cautious and prefer a more predictable approach. In this context, with two defecting neighbors within the interaction radius, it seems prudent to maintain my current strategy of defecting as it minimizes potential losses from nearby particles.","O:0.4, C:0.7, E:0.3, A:0.6, N:0.1"
1,16,33.121320343559645,22.121320343559642,0,0.9985764691704306,0.09531471840625305,3.0,45.0,"Given my high extraversion personality trait (1.0), I'm inclined to take bold actions and focus on maximizing my payoff. Considering the current context, where four out of six neighbors are cooperating, it seems beneficial to defect against them to gain a larger payoff compared to cooperation with cooperators or defecting against defectors. My decision to move towards a direction (45 degrees) is somewhat arbitrary but takes into account my desire for exploration and interaction with potential partners.","O:0.1, C:0.4, E:1.0, A:0.2, N:0.0"
1,17,46.139173100960065,39.00973193125843,1,-0.13864798635761283,-0.2360594369452229,1.0,278.0,"Given my high extraversion (1.0), I tend to be outgoing and sociable, which aligns with cooperating with other particles. Considering my neighbors are both cooperators at a distance within the interaction radius (10), it's beneficial for me to cooperate with them to improve our mutual payoffs, despite their distance. This decision also reflects my agreeableness (0.9) trait, as I prioritize harmonious relationships and reciprocation in interactions.","O:0.9, C:0.7, E:1.0, A:0.9, N:0.0"
1,18,15.435973903246529,13.351860383820433,0,-1.0489355758710746,-0.721108156254102,4.0,153.0,"Given my high neuroticism (0.9), I'm inclined to prioritize self-interest and maximize gains in the short term. In this context, defecting against neighboring defectors is a low-risk strategy that allows me to capitalize on their actions and maintain distance. My openness (0.7) also encourages exploration of opportunities for personal gain.","O:0.7, C:1.0, E:0.3, A:0.8, N:0.9"
1,19,30.0,20.0,1,-9.766284071645565,-0.20287915574307716,1.0,180.0,"My high agreeableness trait (0.5) suggests I'm inclined to cooperate with others, especially those in my vicinity. Considering the current context, four out of six neighbors are cooperating, and one is defecting; this supports a cooperative approach.","O:0.0, C:0.2, E:0.4, A:0.5, N:1.0"
