time,agent_id,x,y,state,score,payoff,action_magnitude,action_direction,reasoning,personality
22,1,28.537636772119143,22.2479618250857,1,48.182193799546276,1.8154766369689628,2.0,90.0,"Given my high openness (0.7) and agreeableness (0.7), I tend to cooperate with others who share similar traits. In the current context, there are several cooperative neighbors within the interaction radius (10), and moving towards them could lead to increased payoffs due to cooperation.","O:0.7, C:0.3, E:0.5, A:0.7, N:0.1"
22,2,49.64498495786915,18.79001379462812,1,100.89594900033535,0.21753099171731294,4.0,217.0,"Given my high extraversion (0.8) and agreeableness (0.5), I'm inclined to cooperate with others, especially those who are cooperative themselves. In this context, the cooperating neighbor at a distance of 2.86 is an opportunity for mutual benefit, aligning with my personality traits.","O:0.1, C:0.7, E:0.8, A:0.5, N:0.3"
22,3,18.291166548407414,29.56542756625372,0,5.815523022946443,1.4943903454283634,3.0,90.0,"Given my high openness to experience, I'm inclined to explore and exploit opportunities for personal gain. In this context, defecting against cooperators nearby seems like an optimal choice to maximize my payoff. My relatively low agreeableness also suggests that I prioritize self-interest over cooperation.","O:1.0, C:0.6, E:0.6, A:0.3, N:0.1"
22,4,16.50286417448928,28.02194693423451,0,7.209910831873398,-1.8536183329080995,2.0,208.0,"Given my high neuroticism (1.0) and low conscientiousness (0.1), I am inclined to make impulsive decisions that prioritize short-term gains over long-term cooperation. In this context, defecting against the nearby defectors aligns with my personality traits by allowing me to take advantage of their defection and potentially gain a larger payoff, despite the risk of losing the cooperation benefits.","O:0.3, C:0.1, E:1.0, A:0.9, N:1.0"
22,5,4.964798380246575,39.7611648545138,0,-2.7362409290123817,-1.4691090402606313,2.0,228.0,"Given my personality traits, particularly high openness (0.6) and agreeableness (0.6), I am inclined to take a calculated risk by defecting against the nearest defector while maintaining a cautious distance. This decision aligns with my conscientiousness trait (0.6), as I weigh the potential benefits of defecting against the risks of being exploited. By choosing this action, I also respond to the current context by targeting the nearest defector and minimizing interactions with potentially cooperative neighbors at a greater distance.","O:0.6, C:0.6, E:0.3, A:0.6, N:0.1"
22,6,11.350875349823582,42.91298497407929,0,7.610190876760463,-1.497647608922417,3.0,15.0,"As a relatively agreeable personality (0.8) and conscientious individual (0.7), I tend to cooperate when possible. However, in this context with all neighboring particles defecting, my agreeableness is outweighed by the need for self-preservation. Given that one neighbor cooperates, it's not worth risking a severe loss; instead, I'll choose to defect and move closer to the cooperative neighbor, potentially improving our mutual payoffs in future interactions.","O:0.0, C:0.7, E:0.3, A:0.8, N:0.1"
22,7,2.5139720402784715,39.46967895965257,0,-12.839411040831497,-1.0662065874165323,4.0,204.0,"Given my high agreeableness (0.9), I am inclined to cooperate with others. However, considering my current strategy is ""Defect"" and I have a neighbor that is also cooperating (State of the neighbor: ""Cooperate""), I will maintain my current strategy to maximize my payoff. The distance to this cooperative neighbor is 2.51, which is within our interaction radius, but not close enough to impact significantly on our payoff structure.","O:0.5, C:0.0, E:0.4, A:0.9, N:0.2"
22,8,25.182248522154207,13.352373639309564,1,19.883432776899117,1.2646738315575559,2.0,120.0,"Given my high agreeableness (0.6) and tendency towards cooperation, I will choose to cooperate with neighbors who are also cooperating. Considering the distances and directions provided by the neighboring agents, moving 2 units in a direction of 120 degrees allows me to maintain proximity to beneficial cooperators while avoiding potential losses from defectors.","O:0.4, C:0.1, E:0.2, A:0.6, N:1.0"
22,9,28.32847597272968,15.9143692235345,0,68.57814177850457,2.299719522262548,3.0,270.0,"My high extraversion (0.8) suggests I'm inclined to take bold actions, which aligns with defecting in this situation. Considering my neighbors' cooperative states and their distances, it seems beneficial to defect, as cooperating with cooperators might not yield significant benefits due to the payoff structure. Defecting also allows me to potentially exploit their cooperation, which is consistent with my relatively low agreeableness (0.4), indicating a tendency to prioritize self-interest over cooperation.","O:0.2, C:0.7, E:0.8, A:0.4, N:0.2"
22,10,28.087092467583574,23.891199608652293,1,16.29498829561018,1.4688613642276973,4.0,135.0,"As an agent with high agreeableness (0.9), I am inclined to cooperate with others, especially those that are cooperative themselves. Given my neighbors' cooperative states and relatively close distances within the interaction radius, it is rational to continue this cooperative behavior, aiming to maintain social relationships and maximize payoffs in a reciprocal manner.","O:0.1, C:0.1, E:0.0, A:0.9, N:0.5"
22,11,7.245832190340466,41.591207396767125,1,-2.1952053833928007,-2.3302617180060117,3.0,205.0,"Given my high extraversion (0.9), I tend to seek interaction and connection with others. In this context, where a neighboring particle is cooperating (State of the neighbor: ""Cooperate"" at Distance to the neighbor: 1.68), I choose to cooperate as well, aiming to build a mutually beneficial relationship. My conscientiousness (1.0) also drives me to consider long-term benefits and strategic positioning in this dynamic environment.","O:0.1, C:1.0, E:0.9, A:0.9, N:0.7"
22,12,30.521132015673725,21.44919560966642,1,41.55325025771426,2.658759008520674,2.0,137.0,"Given my high conscientiousness (0.8) and agreeableness (0.2), I tend to cooperate when possible. In this context, the closest cooperating neighbors are within a reasonable distance (1.45 and 2.01 units), making it beneficial to maintain relationships with them.","O:0.3, C:0.8, E:0.7, A:0.2, N:0.1"
22,13,5.69636453074197,21.22225150358133,1,19.575685615967625,-0.06438183851862153,2.0,180.0,"My high agreeableness (0.8) aligns with cooperating with my cooperative neighbor at a distance of 4.86, which is within our interaction radius. Given the current context, I choose to cooperate to maximize payoff and maintain social relationships, particularly with this beneficial neighbor.","O:0.6, C:0.1, E:0.0, A:0.8, N:0.8"
22,14,28.30064344774045,18.85882671466544,0,21.192963718257833,2.146747401408605,2.0,275.0,"Given my relatively high neuroticism (0.5), I am inclined to take risks and potentially exploit others for personal gain. In this context, moving towards the defecting neighbor at a distance of 1.95 units in direction 275 is rational as it allows me to avoid losses from cooperating with other cooperators while taking advantage of the temptation payoff from defecting against them.","O:0.0, C:0.3, E:0.4, A:1.0, N:0.5"
22,15,0.8071233943657423,18.737722599969285,1,21.586626373993983,2.6396117049842465,2.0,105.0,"As an agent with high conscientiousness (0.7) and moderate agreeableness (0.6), I tend to prioritize cooperation and social harmony. Given my neighbor at a distance of 2.75 units in the direction 105 is cooperating, it's beneficial for me to cooperate as well, considering the closer proximity would amplify our shared payoff.","O:0.4, C:0.7, E:0.3, A:0.6, N:0.1"
22,16,16.488974842930336,28.14716044213778,1,-0.9926716756362719,-12.405925510315535,5.0,205.0,"Given my high extraversion trait (1.0), I'm inclined to engage with others and seek social connections. In this context, I notice a cooperating neighbor at a relatively close distance of 3.04 units, which is within our interaction radius of 10 units. To maximize my payoff, I'll cooperate with them while moving in their direction to strengthen our connection.","O:0.1, C:0.4, E:1.0, A:0.2, N:0.0"
22,17,40.75998054523848,47.994932107817405,1,9.850360877447876,0.8716197275626693,2.0,232.0,"Given my high extraversion score (1.0), I'm inclined to interact and cooperate with others. My current neighbor is also cooperative, which aligns with my agreeableness trait (0.9). Considering the moderate distance of 0.62 from my neighbor, cooperating seems like a strategic move to maintain a positive relationship and potentially receive a higher payoff due to proximity.","O:0.9, C:0.7, E:1.0, A:0.9, N:0.0"
22,18,4.682377049629208,17.285817455928605,1,31.063243118487705,1.071910138167148,2.0,150.0,"Based on high conscientiousness (1.0), I prioritize cooperation to maximize mutual benefits and minimize losses. Considering my neighbors, I will cooperate with the cooperators, aiming to strengthen our relationship and increase shared payoff. The cooperative neighbor at a distance of 6.64 is the primary target for cooperation, as it presents an opportunity to improve both payoffs.","O:0.7, C:1.0, E:0.3, A:0.8, N:0.9"
22,19,17.433947898794884,28.47479515064357,1,-3.5450167614299666,-1.2436913472921136,2.0,28.0,"Given my high agreeableness (0.5) and tendency to respond negatively to stress (high neuroticism), I choose to cooperate with a neighbor in a close distance (2.97) and similar direction (28). This decision also takes into account the moderate level of conscientiousness, which may prompt me to adapt my strategy based on available information; however, cooperating seems more beneficial considering the potential for mutual benefit and reduced conflict compared to defecting.","O:0.0, C:0.2, E:0.4, A:0.5, N:1.0"
22,20,17.55916203914448,25.074523513857315,0,6.039818614971775,0.30257540919536496,2.0,126.0,"Given my low conscientiousness trait (0.0), I tend to prioritize short-term gains over long-term consequences. In this context, defecting against the cooperating neighbor at a relatively close distance (5.1) and moving towards it may yield a large payoff. This decision is also influenced by my moderate level of extraversion (0.3), which suggests I'm moderately inclined to take risks.","O:1.0, C:0.0, E:0.3, A:0.8, N:0.1"
22,21,2.1722340988279067,20.653683403069003,1,37.227876514720954,1.5140903166559316,2.0,37.0,"Based on my agreeableness trait (0.5) and conscientiousness trait (0.5), I prefer to cooperate when possible. Given the proximity of the cooperating neighbor at a distance of 2.86 with a direction of 37 degrees, it is beneficial to stay close and potentially receive higher payoffs for cooperation.","O:0.2, C:0.5, E:0.1, A:0.5, N:0.0"
22,22,5.826931059914539,41.959582665601246,0,-41.25771995314752,-0.7244726859599627,3.0,112.0,"Given my high level of extraversion (1.0) and low agreeableness (0.5), I tend to prioritize self-interest over cooperation. In this context, I will defect against the cooperating neighbor at a distance of 2.59 units in direction 27 degrees, as it is not beneficial for me to cooperate with them when there are more defecting neighbors that could provide larger payoffs.","O:1.0, C:1.0, E:1.0, A:0.5, N:0.8"
22,23,43.462479889739726,1.437633463238278,0,5.127825248586217,0.3198740986876846,3.0,52.0,"Given my high extraversion (0.8) and agreeableness (0.8), I tend to be outgoing and cooperative. However, in this context, considering the neighbor's cooperative state and moderate distance, defecting may yield a larger payoff due to the temptation effect. This decision aligns with my personality traits while responding to the current situation.","O:0.2, C:0.7, E:0.8, A:0.8, N:0.5"
22,24,6.655803156446332,41.655690729359264,1,72.02361319605053,-1.1838647527561952,3.0,195.0,"Given my high extraversion (0.6), I am inclined to take risks and interact with others. In this context, cooperating with the nearby cooperators aligns with this trait, as it allows me to form a positive relationship and potentially gain more payoffs in the future. Additionally, considering the neighboring agents' information, I notice that there is a closer cooperator (0.59 distance) who could bring me benefits if I cooperate, making cooperation my best strategy at this time.","O:0.4, C:0.3, E:0.6, A:0.3, N:0.7"
22,25,5.733756653610109,44.90176640432712,0,16.350997614499995,0.18555928333718194,4.0,90.0,"Given my high extraversion trait (0.9), I'm inclined to take bold action and defect from cooperators, which may lead to larger payoffs in the short term. In this context, considering multiple defectors nearby, it seems like a cooperative strategy might not be as beneficial for me right now. I'll defect and move closer to one of the cooperators at (90 degrees) to potentially gain a higher payoff.","O:0.3, C:0.0, E:0.9, A:0.5, N:0.7"
22,26,8.430380711149072,42.199007874860555,1,10.644160356138535,-0.22855449534886502,2.0,114.0,"With high conscientiousness (0.8), I aim to maintain social relationships and maximize payoffs. Given that one cooperative neighbor is nearby at a distance of 1.93 units in the direction 114 degrees, I choose to cooperate with this beneficial agent to potentially yield larger payoffs. This decision also aligns with my openness trait (0.4) as I'm willing to adapt and take calculated risks for potential benefits.","O:0.4, C:0.8, E:0.3, A:0.0, N:0.7"
22,27,25.450434263599863,12.962198255226346,0,19.19117123493606,3.0291834281426047,2.0,298.0,"Given my high extraversion personality trait (1.0), I am inclined to take bold actions and exploit opportunities for personal gain. In this context, defecting against the nearby defector particle at a distance of 3.53 units in the direction 298 degrees appears to be an attractive option to maximize my payoff. My neuroticism level (0.9) suggests that I may be prone to making impulsive decisions, which aligns with my decision to defect and capitalize on this potentially lucrative opportunity.","O:0.6, C:0.7, E:1.0, A:0.4, N:0.9"
22,28,31.984128306882337,20.07684922114824,1,11.810436953119899,1.3907148789573918,2.0,46.0,"Given my high extraversion (0.9), I am inclined to engage with others and maintain social connections. In this context, where multiple cooperators are within my interaction radius, it is beneficial to cooperate with them, especially considering their close proximity to me. This decision aligns with my agreeableness (1.0) trait, as it prioritizes harmony and mutual benefit over individual gain.","O:0.0, C:0.4, E:0.9, A:1.0, N:0.1"
22,29,19.8011328525436,49.27766502124985,0,1.0896358411521094,0.0,2.0,270.0,"Given my high conscientiousness (0.8), I tend to plan and calculate risks carefully. In this context, I have no neighbors within my interaction radius, but I'm aware of the potential benefits of defecting against a cooperative neighbor if one were to appear. However, considering my low extraversion (0.1), I prefer to avoid unnecessary interactions and will move towards a 270-degree direction to expand my search space for beneficial particles while maintaining a defensive strategy by defecting initially.","O:0.5, C:0.8, E:0.1, A:0.2, N:0.7"
23,0,28.024331587853908,21.477009088245932,1,34.349946255796645,1.8249348932554037,4.0,180.0,"Given my high extraversion (1.0) and agreeableness (0.8), I tend to be outgoing and cooperative. In this context, with multiple cooperating neighbors at close distances, it's beneficial to cooperate with them while moving towards one of the cooperators to further improve our mutual payoffs, aligning with my personality traits and responding effectively to the current context.","O:0.7, C:0.0, E:1.0, A:0.8, N:0.3"
23,1,28.537636772119143,20.2479618250857,1,49.045324960941706,0.8631311613954327,2.0,270.0,"Given my high openness (0.7) and agreeableness (0.7), I tend to cooperate with others. However, considering my low conscientiousness (0.3), I'm not too concerned about long-term consequences. In this context, cooperating with the nearest cooperative neighbor at a distance of 1.7 is beneficial as it yields a moderate payoff while maintaining social relationships.","O:0.7, C:0.3, E:0.5, A:0.7, N:0.1"
23,2,49.64498495786915,16.79001379462812,1,102.0820064233791,1.186057423043756,2.0,270.0,"Given my high conscientiousness (0.7), I prioritize cooperation to maintain social relationships and avoid losses from defecting against cooperators. With four cooperative neighbors at close distances, I choose to cooperate with the closest neighbor (distance 1.16) while moving towards them at a moderate pace of 2 units in the direction of 270 degrees. This decision aligns with my agreeableness trait (0.5), as I seek to maintain harmony and reciprocate cooperation from others.","O:0.1, C:0.7, E:0.8, A:0.5, N:0.3"
23,3,17.03252576630774,28.01113564333978,1,7.02423471311778,1.2087116901713375,2.0,231.0,"Given my high level of openness (1.0), I am inclined to explore and adapt to new situations, making cooperation a more appealing option in this context. Considering the two cooperators within my interaction radius, moving towards them will allow me to potentially benefit from larger payoffs due to closer proximity. This decision also aligns with my moderate level of extraversion (0.6), as I am willing to take calculated risks to interact and cooperate with others.","O:1.0, C:0.6, E:0.6, A:0.3, N:0.1"
23,4,16.18927878468632,31.00551262033933,1,8.225122705849389,1.0152118739759908,3.0,96.0,"Given my high extraversion (1.0) and agreeableness (0.9) traits, I'm inclined to cooperate with others, especially those close by. Since the cooperators are within a reasonable distance (0.13 units), it's beneficial for me to cooperate with them, which is in line with my personality traits.","O:0.3, C:0.1, E:1.0, A:0.9, N:1.0"
23,5,0.9647983802465747,39.7611648545138,0,-3.074963785115027,-0.3387228561026453,4.0,180.0,"My high conscientiousness and agreeableness suggest I'm likely to defect against cooperators to maximize my payoff, while avoiding cooperation with potential cheaters. Considering the neighbors' states, I'll move towards the cooperative neighbor at a 45-degree angle (180 degrees from its direction) to maintain a safe distance while potentially repositioning for future interactions.","O:0.6, C:0.6, E:0.3, A:0.6, N:0.1"
23,6,9.410283897271588,42.42914118287996,1,8.7656867993377,1.1554959225772377,2.0,194.0,"Given my high agreeableness (0.8) and low neuroticism (0.1), I tend to prioritize cooperation over defection. In this context, I notice that there are multiple cooperators in close proximity, including one at a distance of 3.01 units with direction 193 degrees, suggesting it would be beneficial to move closer and cooperate, potentially increasing my payoff through mutual benefit.","O:0.0, C:0.7, E:0.3, A:0.8, N:0.1"
23,7,2.513972040278471,36.46967895965257,1,-12.91327478011972,-0.07386373928822274,3.0,270.0,"As an agent with high agreeableness (0.9) and openness to experience (0.5), I tend to prioritize cooperation and social harmony. In this context, there are two cooperating neighbors within my interaction radius, which suggests a potential benefit from cooperation. Given the moderate distance between myself and these cooperators, I decide to move towards them while choosing to cooperate, aiming to improve our shared payoff.","O:0.5, C:0.0, E:0.4, A:0.9, N:0.2"
23,8,26.85982723256645,10.865260921644438,0,19.32122975458248,-0.562203022316637,3.0,304.0,"Given my high neuroticism (1.0), I tend to prioritize self-preservation over cooperation. In this context, I will defect against cooperators and move closer to them to maximize my own payoff, as three of the cooperators are within my interaction radius and could potentially provide benefits if they defect.","O:0.4, C:0.1, E:0.2, A:0.6, N:1.0"
23,9,25.32847597272968,15.9143692235345,0,68.82593148524525,0.2477897067406735,3.0,180.0,"Given my high extraversion (0.8), I'm inclined to take bold actions and exploit cooperative neighbors for personal gain. In this context, defecting against the majority of cooperating neighbors will allow me to maximize my payoff by taking advantage of their trust.","O:0.2, C:0.7, E:0.8, A:0.4, N:0.2"
23,10,28.604730557788614,21.959347956074158,1,18.75835720789358,2.4633689122834017,2.0,285.0,"Given my high agreeableness trait (0.9), I tend to prioritize cooperation and maintaining relationships. In the current context, two of my neighbors are cooperating, which aligns with my cooperative nature. Considering their proximity and cooperative state, it's beneficial for me to cooperate with them as well, while also moving closer to them by changing direction slightly towards the 285-degree angle.","O:0.1, C:0.1, E:0.0, A:0.9, N:0.5"
23,11,2.4162030588951255,42.88530262227973,0,-2.0596612915484624,0.13554409184433816,5.0,165.0,"Given my high extraversion (0.9) and conscientiousness (1.0), I tend to be outgoing and goal-oriented, which might lead me to take a riskier approach in this context. Considering the neighbors' states are mostly defecting, and only one is cooperating, it's beneficial for me to defect against them, taking advantage of the temptation payoff while minimizing losses from potential sucker's payoffs.","O:0.1, C:1.0, E:0.9, A:0.9, N:0.7"
23,12,27.742498533837736,24.326554811021023,1,42.552206779091584,0.9989565213773247,4.0,134.0,"Given my high conscientiousness (0.8), I am inclined to cooperate with those who are also cooperative (neighbors at distances of 1.5 and 3.45). This decision is in line with my agreeableness trait (0.2) as I prefer reciprocal relationships, which can lead to mutual benefits.","O:0.3, C:0.8, E:0.7, A:0.2, N:0.1"
23,13,1.7456111683614193,20.59651364342041,1,23.48701212629887,3.9113265103312442,4.0,189.0,"Given my high agreeableness trait (0.8), I am inclined to cooperate with others. In this context, moving closer to one of the cooperators and maintaining a cooperative strategy seems beneficial for both parties, considering our mutual cooperation will yield moderate payoffs and we can potentially gain more by being near each other.","O:0.6, C:0.1, E:0.0, A:0.8, N:0.8"
23,14,28.30064344774045,15.85882671466544,0,21.629657667447628,0.4366939491897943,3.0,270.0,"Given my high agreeableness trait (1.0), I am inclined to defect against the cooperative neighbor at a distance of 2.94, which is within my interaction radius. However, my high neuroticism trait (0.5) makes me cautious and prone to taking risks; therefore, I choose to defect to potentially gain a larger payoff while being prepared for potential losses.","O:0.0, C:0.3, E:0.4, A:1.0, N:0.5"
23,15,0.807123394365742,16.737722599969285,1,23.51629772414404,1.9296713501500564,2.0,270.0,"As a relatively conscientious (0.7) and agreeable (0.6) individual, I tend to prioritize cooperation and harmony. Considering my neighbors are all cooperating and within the interaction radius, it is beneficial for me to continue this cooperative strategy to maintain social relationships and potential future benefits.","O:0.4, C:0.7, E:0.3, A:0.6, N:0.1"
23,16,16.907088696000947,24.169072860664684,0,-0.9982780627002874,-0.005606387064015506,4.0,276.0,"Given my high extraversion level (1.0), I'm inclined to take bold actions and exploit opportunities for personal gain. In this context, I notice that the closest neighbor (Distance: 0.13) is defecting, which suggests a potential opportunity for me to benefit from their cooperation while minimizing losses.","O:0.1, C:0.4, E:1.0, A:0.2, N:0.0"
23,17,40.75998054523848,44.994932107817405,0,9.707228749443043,-0.1431321280048328,3.0,270.0,"As an extremely extraverted (1.0) and agreeable individual (0.9), I tend to be highly social and inclined towards cooperation in most situations. However, given the neighboring agent is defecting and my current strategy of cooperating hasn't yielded benefits, I should defect to avoid losses. This decision aligns with my conscientious nature (0.7) as it involves a cautious approach to optimize my payoff.","O:0.9, C:0.7, E:1.0, A:0.9, N:0.0"
23,18,3.182377049629209,19.88389366728192,0,33.69156289153329,2.6283197730455803,3.0,120.0,"Given my high conscientiousness (1.0), I aim to maintain a cooperative strategy to maximize benefits from neighbors and build trust. Considering my openness (0.7) and agreeableness (0.8), I prioritize cooperation with cooperative neighbors within the interaction radius, especially those closer than 4.2 units away. The direction is chosen to move towards one of the cooperating neighbors while maintaining a moderate distance for future interactions.","O:0.7, C:1.0, E:0.3, A:0.8, N:0.9"
23,19,15.54291074759625,27.823658841729255,0,-2.731015285812782,0.8140014756171844,2.0,199.0,"As a highly neurotic individual (neuroticism = 1.0), I'm inclined to prioritize self-preservation and take advantage of opportunities for personal gain. In this context, defecting against the single cooperator while moving towards it may seem counterintuitive, but given my neurotic nature, I'll exploit its trusting behavior to maximize my payoff.","O:0.0, C:0.2, E:0.4, A:0.5, N:1.0"
23,20,16.55916203914448,26.806574321426194,1,5.858866730910999,-0.18095188406077634,2.0,120.0,"Given my high openness trait (1.0), I'm inclined to cooperate with others when possible, despite being a defector in the past. Considering my agreeableness trait (0.8) and the presence of cooperating neighbors at moderate distances, it's beneficial to cooperate and move closer to them to improve payoffs. This decision also aligns with my low conscientiousness trait (0.0), as I'm willing to take a chance on cooperation despite past losses.","O:1.0, C:0.0, E:0.3, A:0.8, N:0.1"
